Tavola 6 - Popolazione residente, popolazione universitaria (valori assoluti) e quartili delle distanze tra luogo di residenza e comune sede di Ateneo  - Città universitarie. Dicembre 2019;;;;;;;;;;;
;;;;;;;;;;;
Dati di base ;;;;;Popolazione universitaria;;;;;;
Codice Istat comune sede di Ateneo;Denominazione ;Denominazione comune sede di Ateneo;Popolazione residente anagrafica 31/12/2019;;Studenti universitari insistenti sul comune sede di Ateneo (*);Studenti universitari con mobilità all'interno del proprio comune ;Mobilità in entrata da altro comune;;;;Studenti universitari con mobilità in uscita dal proprio comune
;;;;;;;Studenti universitari;Quartili delle distanze tra origine e destinazione (in km);;;
;;;;;;;;;;;
;;;;;;;;Q1 ;Q2;Q3;
001272;"UNIVERSITÀ DEGLI STUDI DI TORINO;                                                       
POLITECNICO DI TORINO";Torino;848.533;;71.404;17.673;53.190;22,40;64,71;607,90;2.750
002158;"UNIVERSITÀ DEGLI STUDI DEL PIEMONTE ORIENTALE ""AMEDEO AVOGADRO""";Vercelli;45.781;;983;88;892;21,12;35,34;47,02;745
004029;UNIVERSITÀ NON STATALE DI SCIENZE GASTRONOMICHE;Bra;29.415;;296;82;210;43,88;135,42;288,72;419
007003;UNIVERSITÀ DELLA VALLE D'AOSTA;Aosta;33.546;;425;60;363;22,84;60,27;120,71;478
010025;UNIVERSITÀ DEGLI STUDI DI GENOVA;Genova;558.883;;18.893;9.276;9.512;32,56;44,21;92,99;2.471
012042;"UNIVERSITÀ ""CARLO CATTANEO"" - LIUC";Castellanza;14.310;;2.060;49;2.009;12,40;27,94;286,46;209
012133;UNIVERSITÀ DEGLI STUDI INSUBRIA VARESE-COMO;Varese;79.603;;5.859;474;5.367;14,08;21,53;30,49;1.073
015146;"LIBERA UNIVERSITÀ ""VITA SALUTE S.RAFFAELE""  MILANO; 
UNIVERSITÀ DEGLI STUDI DI MILANO - BICOCCA;
UNIVERSITÀ DEGLI STUDI DI MILANO;
POLITECNICO DI MILANO;
UNIVERSITA' COMMERCIALE ""LUIGI BOCCONI"" MILANO;
UNIVERSITÀ CATTOLICA DEL SACRO CUORE;
LIBERA UNIVERSITÀ DI LINGUE E COMUNICAZIONE IULM-MI";Milano;1.393.896;;133.431;26.343;104.302;21,18;43,46;201,12;4.972
015189;HUMANITAS UNIVERSITY;Rozzano;41.479;;320;10;289;9,97;9,97;109,09;552
016024;UNIVERSITÀ DEGLI STUDI DI BERGAMO;Bergamo;118.572;;9.979;897;9.067;11,51;21,93;34,37;1.762
017029;UNIVERSITÀ DEGLI STUDI DI BRESCIA;Brescia;193.833;;12.029;1.949;10.072;12,71;24,06;36,46;1.714
018110;"UNIVERSITÀ DEGLI STUDI DI PAVIA;
ISTITUTO UNIVERSITARIO STUDI SUPERIORI (IUSS)";Pavia;70.744;;17.053;1.833;15.109;24,44;39,98;123,51;674
021008;LIBERA UNIVERSITÀ DI BOLZANO;Bolzano;105.568;;1.724;428;1.213;24,92;51,16;132,14;1.070
022205;UNIVERSITÀ DEGLI STUDI DI TRENTO;Trento;118.068;;11.705;1.473;10.174;48,53;76,76;144,15;1.379
023091;UNIVERSITÀ DEGLI STUDI DI VERONA;Verona;255.433;;10.320;1.715;8.582;21,24;39,34;67,94;2.839
027042;"UNIVERSITÀ ""CA' FOSCARI"" DI VENEZIA;
UNIVERSITÀ IUAV DI VENEZIA";Venezia;256.015;;13.928;1.492;12.242;32,26;54,35;117,20;2.549
028060;UNIVERSITÀ DEGLI STUDI DI PADOVA;Padova;205.714;;30.339;3.232;26.962;24,47;40,87;80,87;2.147
030129;UNIVERSITÀ DEGLI STUDI DI UDINE;Udine;99.326;;8.865;1.038;7.807;18,40;36,45;62,86;1.225
032006;UNIVERSITÀ DEGLI STUDI DI TRIESTE;Trieste;198.526;;9.920;2.602;7.104;55,98;93,97;150,35;1.149
034027;UNIVERSITÀ DEGLI STUDI DI PARMA;Parma;197.290;;18.251;3.016;15.205;32,28;69,33;525,42;1.272
036023;UNIVERSITÀ DEGLI STUDI DI MODENA E REGGIO EMILIA;Modena;186.698;;11.570;1.820;9.740;18,05;35,30;302,84;2.021
037006;UNIVERSITÀ DEGLI STUDI DI BOLOGNA;Bologna;391.382;;43.437;6.578;36.430;48,97;123,45;336,50;2.394
038008;UNIVERSITÀ DEGLI STUDI DI FERRARA;Ferrara;131.149;;16.489;1.925;14.537;43,86;79,29;344,55;911
041067;"UNIVERSITÀ DEGLI STUDI DI URBINO ""CARLO BO""";Urbino;13.801;;8.671;299;8.207;33,49;77,74;335,14;128
042002;UNIVERSITÀ POLITECNICA DELLE MARCHE;Ancona;98.716;;9.224;955;8.262;33,85;58,70;127,52;1.289
043007;UNIVERSITÀ DEGLI STUDI DI CAMERINO;Camerino;6.292;;2.726;322;2.380;38,95;58,55;188,44;119
043023;UNIVERSITÀ DEGLI STUDI DI MACERATA;Macerata;40.776;;6.087;428;5.640;20,90;35,61;64,34;618
048017;UNIVERSITÀ DEGLI STUDI DI FIRENZE;Firenze;363.511;;35.054;6.988;27.940;17,79;37,11;99,16;1.860
050026;"UNIVERSITÀ DI PISA;
SCUOLA SUPERIORE SANT'ANNA;
SCUOLA NORMALE SUPERIORE";Pisa;89.053;;33.309;2.739;30.556;20,36;47,04;259,28;524
052032;"UNIVERSITÀ DEGLI STUDI DI SIENA; 
UNIVERSITÀ PER STRANIERI DI SIENA";Siena;53.521;;12.240;1.468;10.743;47,54;151,08;474,64;586
054039;"UNIVERSITÀ DEGLI STUDI DI PERUGIA;
UNIVERSITÀ PER STRANIERI DI PERUGIA";Perugia;163.788;;16.018;3.603;12.390;30,71;49,14;135,16;1.091
056059;UNIVERSITÀ DEGLI STUDI DELLA TUSCIA;Viterbo;65.066;;5.163;767;4.394;22,36;35,63;66,19;833
058091;"UNIVERSITA' DEGLI STUDI DI ROMA ""LA SAPIENZA"";
UNIVERSITÀ DEGLI STUDI DI ROMA ""TOR VERGATA"";
UNIVERSITÀ DEGLI STUDI ROMA TRE; 
UNIVERSITÀ DEGLI STUDI INTERNAZIONALI DI ROMA (UNINT);  
UNIVERSITA' DEGLI STUDI DI ROMA ""FORO ITALICO"";                                                              UNIVERSITÀ NON STATALE EUROPEA DI ROMA;
LIBERA UNIVERSITÀ DEGLI STUDI ""MARIA SS.ASSUNTA"" ROMA ; 
LIBERA UNIV. INTER.LE STUDI SOCIALI ""GUIDO CARLI"" LUISS-ROMA;                                                                                              UNIVERSITÀ ""CAMPUS BIO-MEDICO"" ROMA;
LINK CAMPUS UNIVERSITY;                                                                                                              UNICAMILLUS - INTERNATIONAL UNIVERSITY OF HEALTH AND MEDICAL SCIENCES";Roma;2.780.728;;161.714;68.793;92.138;38,77;109,75;389,58;6.557
060019;UNIVERSITÀ DEGLI STUDI DI CASSINO E DEL LAZIO MERIDIONALE;Cassino;36.106;;5.409;947;4.436;18,00;30,89;43,22;557
061022;SECONDA UNIVERSITÀ DEGLI STUDI DI NAPOLI;Caserta;73.589;;6.051;479;5.571;13,16;18,75;29,85;2.612
062008;UNIVERSITÀ DEGLI STUDI DEL SANNIO DI BENEVENTO                  ;Benevento;57.755;;4.207;666;3.541;14,77;23,65;33,99;1.303
063049;"UNIVERSITÀ DEGLI STUDI DI NAPOLI ""FEDERICO II"";
UNIVERSITÀ DEGLI STUDI DI NAPOLI ""PARTHENOPE""; 
UNIVERSITÀ DEGLI STUDI DI NAPOLI ""L'ORIENTALE"";                      
UNIVERSITÀ DEGLI STUDI SUOR ORSOLA BENINCASA";Napoli;944.812;;111.161;21.180;89.871;11,91;24,93;63,64;2.847
065052;UNIVERSITÀ DEGLI STUDI DI SALERNO;Fisciano;13.755;;27.305;446;26.838;11,33;22,07;33,88;118
066049;UNIVERSITÀ DEGLI STUDI DE L'AQUILA;L'aquila;69.293;;10.813;1.858;8.945;42,49;62,07;91,27;711
067041;UNIVERSITÀ DEGLI STUDI DI TERAMO;Teramo;53.800;;3.125;372;2.751;26,41;47,14;98,30;1.246
069022;"UNIVERSITÀ DEGLI STUDI ""G. D'ANNUNZIO"" CHIETI-PESCARA";Chieti;49.977;;11.430;654;10.773;23,05;89,53;229,74;970
070006;UNIVERSITÀ DEGLI STUDI DEL MOLISE;Campobasso;47.882;;4.701;674;4.026;27,56;45,48;64,20;1.112
071024;UNIVERSITÀ DEGLI STUDI DI FOGGIA;Foggia;149.097;;7.569;1.865;5.704;29,72;37,41;63,65;2.004
072006;"UNIVERSITÀ DEGLI STUDI DI BARI ""ALDO MORO"";
POLITECNICO DI BARI";Bari;313.906;;35.797;5.674;30.097;25,65;42,58;68,73;2.066
072015;"UNIVERSITÀ MEDITERRANEA ""JEAN MONNET""";Casamassima;19.444;;1.163;23;1.140;19,48;24,92;55,23;350
075035;UNIVERSITÀ DEGLI STUDI DEL SALENTO;Lecce;93.141;;13.375;1.296;12.077;17,76;35,86;47,91;1.387
076063;UNIVERSITÀ DEGLI STUDI DELLA BASILICATA;Potenza;65.477;;3.852;901;2.951;20,19;33,92;57,77;1.509
078102;UNIVERSITÀ DELLA CALABRIA;Rende;35.634;;17.715;1.204;16.502;19,57;51,63;77,79;564
079023;"UNIVERSITÀ DEGLI STUDI ""MAGNA GRAECIA"" DI CATANZARO";Catanzaro;87.081;;9.351;1.662;7.687;25,17;50,07;72,59;1.549
080063;"UNIVERSITÀ PER STRANIERI ""DANTE ALIGHIERI"" DI REGGIO CALABRIA;                                                                                            UNIVERSITÀ DEGLI STUDI ""MEDITERRANEA"" DI REGGIO CALABRIA";Reggio di Calabria;174.366;;4.621;1.978;2.628;24,42;42,38;69,42;4.047
082053;UNIVERSITÀ DEGLI STUDI DI PALERMO;Palermo;643.394;;34.766;13.153;21.608;22,65;57,80;85,40;3.833
083048;UNIVERSITÀ DEGLI STUDI DI MESSINA;Messina;226.580;;18.403;4.975;13.414;27,67;52,37;89,69;1.591
086009;"LIBERA UNIVERSITÀ DELLA SICILIA CENTRALE ""KORE"" SEDE ENNA";Enna;26.265;;4.227;266;3.960;27,07;55,86;76,55;556
087015;UNIVERSITÀ DEGLI STUDI DI CATANIA;Catania;294.856;;31.009;5.158;25.841;13,49;33,30;65,33;1.848
090064;UNIVERSITÀ DEGLI STUDI DI SASSARI;Sassari;124.640;;8.600;2.390;6.205;18,15;47,74;86,38;1.001
092009;UNIVERSITÀ DEGLI STUDI DI CAGLIARI;Cagliari;150.139;;18.254;3.189;15.060;7,06;12,77;98,80;890
;;Totale;13.000.005;;1.132.390;241.425;884.654;;;;85.051
;;;;;;;;;;;
"Nota: per le elaborazioni relative a questa Tavola non sono stati considerati: 1) gli Atenei Telematici (Undici Atenei riconosciuti dal Miur); 2) gli studenti lavoratori (classificati come lavoratori nella base dati)  ";;;;;;;;;;;
(*) Nel totale della popolazione insistente sono inclusi anche individui il cui comune di origine non rientra nella classificazione ufficiale Istat dei Comuni Italiani;;;;;;;;;;;
