Ateneo;maturita95+;eta23+;segnale_occupazione;genitore_laureato;genitore_bassa_intestita_lavorativa;reddito_medio
Politecnico di Torino;26,3;33,5;11,4;35,7;11,6;25,5
Univ. degli Studi di Torino;12,4;36;22,6;28,1;12,2;25
Univ. degli Studi del Piemonte Orientale “A. Avogadro”-Vercelli;9;34;21,2;22,2;12,8;23
Univ. degli Studi di Scienze Gastronomiche;13,2;26,6;15,2;60,8;11;48,2
Univ. della Valle d’Aosta;8,7;44;45,6;17,3;11,7;24,1
Univ. degli Studi di Genova;12,2;36,9;22,4;32,8;13,9;25,3
Univ. “Carlo Cattaneo” - LIUC;8,8;28,8;12,1;45,4;9,5;37,3
Univ. degli Studi Insubria Varese-Como;7,3;31,2;20,5;23,3;14,4;23,7
Univ. Telematica “E-CAMPUS”;7,6;80,4;60,2;27,9;27,6;22,9
Libera Univ. “Vita Salute S.Raffaele” Milano;30,1;16,9;7;64;6;44,8
Libera Univ. di lingue e comunicazione IULM-MI;6,9;19,3;16,7;34;10,9;27,9
Politecnico di Milano;19,7;27,6;10,6;40,5;9,3;29,7
Univ. Cattolica del Sacro Cuore;14,3;24,8;15,3;39,3;10,4;29,8
Univ. Commerciale “Luigi Bocconi” Milano;42,2;9,4;5,8;62,5;8,3;42,5
Univ. degli Studi di Milano;10,6;34,8;21,2;31,9;12,7;26,3
Univ. degli Studi di Milano-Bicocca;9,4;33,4;24,8;23,7;11,5;24,9
HUMANITAS University;21,9;6,2;5,5;64,3;7,7;46,8
Univ. degli Studi di Bergamo;7,4;36,3;30,5;17,6;14,1;22,5
Univ. degli Studi di Brescia;11,9;33,7;21,7;23,9;11,4;23,4
Univ. degli Studi di Pavia;16,7;31;15;33;11,4;25,7
Libera Univ. di Bolzano;11,5;34,5;40,7;22,9;10;26,9
Univ. degli Studi di Trento;16,1;33,9;25,3;29,7;10,3;25,6
Univ. degli Studi di Verona;10,2;32,1;29,5;22,1;10,8;23,1
Univ. “Cà Foscari” Venezia;11,3;30,8;25,8;26,1;11,4;23,8
Univ. IUAV di Venezia;8,7;33,9;19,6;31,9;10,5;25,1
Univ. degli Studi di Padova;16,3;33,4;22;27,4;11;23,9
Univ. degli Studi di Udine;11,6;34,4;23,6;21,1;12,2;23,3
Univ. degli Studi di Trieste;14,8;38,8;22,1;32,9;12,7;25,8
Univ. degli Studi di Parma;14,2;41,3;23,5;30,1;11,6;24,9
Univ. degli Studi di Modena e Reggio Emilia;14,5;32,6;24,3;28,5;9,9;26,3
Univ. degli Studi di Bologna;9,4;34,2;21;36,5;11,4;25,8
Univ. degli Studi di Ferrara;13,5;38,1;20,7;32,8;11,5;24,7
Univ. degli Studi di Urbino Carlo Bo;9,9;39,5;27,6;26,8;13,6;20,3
Univ. Politecnica delle Marche;20,6;34,6;19,3;26,4;10,5;21,5
Univ. degli Studi di Camerino;12,3;49,1;23;33,1;15,8;22,2
Univ. degli Studi di Macerata;14,4;43,1;29,4;22,2;14,1;19,9
Univ. degli Studi di Firenze;13,4;39,3;21,8;31,4;12,1;24,3
Univ. di Pisa;21,2;43,4;19,1;32,5;14,5;23,5
Univ. degli Studi di Siena;17,6;37,8;18,6;33,4;12,9;22,9
Univ. per Stranieri di Siena;16;20;14,7;23,4;11,5;20,2
Univ. degli Studi di Perugia;18;38,3;18,7;32,4;12,7;22
Univ. per Stranieri di Perugia;10,9;60,7;26,2;30,1;16,9;19,4
Univ. degli Studi della Tuscia;10,8;40,8;31,9;22;17,5;19
Libera Univ. Inter.le Studi Sociali “Guido Carli” LUISS-Roma;30,7;13,6;6,1;67,1;9,8;43,9
Libera Univ. degli Studi “Maria SS.Assunta” - LUMSA;9,8;37,6;16,3;43,1;18,1;25,8
LINK CAMPUS University;6,6;71;47,7;42,7;25,2;28,6
UNICUSANO-Telematica Roma;8,5;81,8;59,8;24,9;30,6;19,7
Univ. “Campus Bio-Medico” di Roma;38,7;18,1;5,0;67,2;8,5;41,1
Univ. degli Studi di Roma “Foro Italico”;4,8;36,5;16,2;31,6;14,6;24,3
Univ. degli Studi di Roma “La Sapienza”;12,0;43,9;17,0;35,7;17,7;22,9
Univ. degli Studi di Roma “Tor Vergata”;16,2;37,7;17,4;30,6;15,6;22,2
Univ. degli Studi Europea di Roma;6,8;26,2;13,4;50,3;15,9;32,8
Univ. degli Studi Internazionali di Roma (UNINT);15,8;35,7;15,5;42,7;12,9;28,6
Univ. degli Studi ROMA TRE;12,4;40,0;20,5;36,8;17,3;25,2
Univ. Telematica “Universitas MERCATORUM”;10,2;86,4;69,5;25,2;36,7;22,0
Univ. Telematica Guglielmo Marconi;11,3;93,1;71,1;27,1;36,4;21,8
Univ. Telematica Internazionale UNINETTUNO;12,7;92,0;77,6;19,7;47,1;19,2
Univ. Telematica San Raffaele Roma;4,4;61,5;44,2;31,4;20,2;24,0
Univ. Telematica UNITELMA SAPIENZA;12,8;86,5;67,8;27,0;35,2;19,8
Univ. degli Studi di Cassino e del Lazio Meridionale;11,4;42,0;18,3;19,1;19,8;15,4
Seconda Univ. degli Studi di Napoli;19,1;42,2;13,6;29,4;24,6;16,8
Univ. degli Studi del Sannio di Benevento;17,5;42,1;11,4;23,4;18,4;15,3
Univ. Telematica Giustino Fortunato”;8,3;81,5;51,0;40,1;29,4;24,6
Univ. degli Studi di Napoli “Federico II”;22,2;38,0;10,8;30,2;21,7;16,8
"Univ. degli Studi di Napoli ""L'Orientale""";16,5;30,8;11,3;23,8;23,0;15,3
"Univ. degli Studi di Napoli ""Parthenope""";8,2;38,3;16,7;24,2;23,0;15,4
Univ. degli Studi Suor Orsola Benincasa - Napoli;7,7;38,3;15,4;27,7;23,7;17,1
Univ. Telematica PEGASO;7,8;76,9;56,6;25,4;29,2;18,6
Univ. degli Studi di Salerno;18,3;41,4;13,5;24,7;21,9;14,8
Univ. degli Studi de L’Aquila;13,9;52,6;28,7;24,8;18,1;19,0
Univ. degli Studi di Teramo;10,6;48,9;27,4;25,7;16,5;18,8
Univ. degli Studi “G. d’Annunzio” Chieti-Pescara;12,8;39,5;17,9;24,9;16,3;17,5
Univ. degli Studi del Molise;11,4;44,7;17,2;23,0;17,9;15,7
Univ. degli Studi di Foggia;17,1;38,6;14,5;20,4;20,8;14,3
Politecnico di Bari;29,8;46,3;15,0;26,3;19,9;17,3
Univ. degli Studi di Bari Aldo Moro;20,7;39,5;19,0;22,4;22,4;15,5
LUM “Jean Monnet”;9,0;42,7;21,9;40,6;14,6;26,8
Univ. del Salento;17,3;42,6;21,1;18,3;27,4;14,1
Univ. degli Studi della Basilicata;11,7;51,7;18,0;15,8;21,3;13,8
Univ. della Calabria;24,6;43,7;13,1;20,8;25,1;13,5
Univ. degli Studi “Magna Graecia” di Catanzaro;21,5;39,0;13,7;26,6;23,4;15,2
Univ. degli Studi “Mediterranea” di Reggio Calabria;20,2;48,0;14,1;27,1;29,8;15,5
Univ. per Stranieri “Dante Alighieri” di Reggio Calabria;9,8;50,6;24,4;17,7;36,3;13,8
Univ. degli Studi di Palermo;18,9;38,8;10,2;30,4;24,8;17,7
Univ. degli Studi di Messina;20,2;43,9;14,1;30,1;26,2;16,9
UKE - Univ. Kore di Enna;9,2;34,9;12,2;30,4;19,9;19,1
Univ. degli Studi di Catania;21,3;50,4;15,3;27,3;26,1;16,4
Univ. degli Studi di Sassari;12,6;51,3;22,8;22,5;25,0;17,1
Univ. degli Studi di Cagliari;13,9;51,1;19,5;22,3;25,2;17,5
Totale;15,5;39,7;20,2;29,9;16,6;21,7